Card_id,Header,Review,Location,shop
607f4777f9f4870360602292,I was very disappointed with this…,I was very disappointed with this company I ordered an item and received something completely different I got in touch and they offered a refund 24 days ago and now they keep stalling not a bit happy,Ireland,Wish
54076a350000640002a3395e,I love nelly !,I shop at nelly.com ! And i will never stopp! They have some off My favoritt shoes!,Norway,Nelly
54f6a5100000ff0002d1b852,A recommended purchase!!,I recently shopped from sheinside from the first time on my friend's reference.I bought a long sleeves blouse and it was looking beautiful on dummy wearing it.Its really comfortable and quality of fabric is No 1.Shipment is always on time.Customers support is also friendly treating customers and explain everything about the products.What i liked the most on sheinside was its reasonable rates and discounts on most of the products.I realized a great loss of money from shopping outside the sheinside in the past days.Thanks to my friend i got this wonderful company as well as quality shopping.Highly recommended to all who wished to shop at compatible rates.,United States,Sheinside
5c2cb7fd9d378006e8fbd085,Very bad customer service and products.,Very bad customer service and products. I wanted to return two things and i have been waiting for pick up for a week now. Absolutely unacceptable. Shocking customer service and their delivery partners are bad too. Pls be cautious shopping with these lot.,Britain (UK),Zalando
60abccf2f9f4870b700cf04b,Its great,Wish is good . You just have to read full descriptions so you do not get dissipointed,United States,Wish
6064c5b0f85d75087040e54d,Love shopping at wish,Love shopping at wish! Everything I ordered is always as pictured and arrives in decent time! I will continue to keep shopping from wish!,United States,Wish
549c1e1e0000640002bfaeb2,Get a great deal!!!,I have ordered a dress with this site. First of all i got the great deal on that dress which i have ordered. I was also impressed with the service and the quality of the dress. I also admit that the site is very user freindly and also provide good deals. I would definitely recommend this site to those who love online shopping. Love this one!!!,India,Sheinside
55bfa2ef0000ff0002fbd213,Worst Company / Quality Ever!!!,-1,United States,Sheinside
5f806201798e6f0b94f3bc06,Great site with good discounts,Great site with good discounts. I ordered to the UK and had free shipping which was a real plus!,Britain (UK),Boozt
606b2340f85d750870491d76,Great item,Great item would buy again,United States,Wish
5a6233626116dd0d6474dd8c,Fantastic,"The sites easy to navigate, sign up to newsletter for a £10 voucher. Next day delivery is a very reasonable price abd the quality and size ranges are amazing. I Am a womens uk 10 which is hard to come by but with zalando i had a choice! Its rare a place has my size and if they do i usually only have 1 option. Will definitely use again!",Britain (UK),Zalando
609f81b1f9f4870a94a2d20a,I am very Happy to shop at Boozt,"I am very Happy to shop at Boozt. All process is easy, transparent and 100% reliable.",Latvia,Boozt
5a5e12e36116dd0d6473a561,Great service  and  I was updated …,Great service  and  I was updated throughout the delivery process ! Highly Recommended,Britain (UK),Zalando
591ec710a02b420900674f44,Fit brilliant delivery was quick …,Fit brilliant delivery was quick delivered on the day they said will shop there again😁,Britain (UK),Zalando
5fc630475e693f08f00fc946,reliable,"reliable, correct, fast",Hungary,Boozt
5f456f5a02e8570814f8dfc8,HORRIBLE still have not got my order…,HORRIBLE still have not got my order almost $90wasted totally upset never shopping there AGAIN!!!!,United States,Sheinside
5ea352ff086b6409bc8d1414,My experience,"DO NOT BUY HERE. The list just goed on: false advertisement, hidden costs and terrible customer service. In the end I had to pay €15 to return €50 of items.",Netherlands,Nelly
60776b5df85d7508705d3590,Wish is really a good company to do…business with,Wish is really a good company to do business with. If there is a problem the company goes out of their way to rectify the problem. A pleasure to do business with.,Australia,Wish
608f9f59f9f48708f0ea1575,"I would not trust them, stay clear and save your money.","When I first joined I thought it was great, I bought loads of things the prices were fantastic and I managed to get some really great bargains. Now they have become greedy con artists, the prices have gone up and the amount of times I have been conned by their false advertising I have lost track. You see something you are interested in at a great price but when it arrives it is nothing like what you were looking at. If you buy clothing you have to buy 4x larger and then sometimes it still does not fit.",Britain (UK),Wish
60b592b0f9f4870a94b25ad2,Do not buy anything from wish,Do not buy anything from wish. They are super slow. I did not received my two item now. It pass 5 days from arrival date. There refund policy is joke. They said wiat another month to refund. Please please do not by anything from this beggars. Hated.,Australia,Wish
54d0e1390000ff0002c9e113,Very good service,"I have ordered multiple times from Nelly, I love this shop. They deliver fast and their service is great! When there is a problem they offer great help.",Netherlands,Nelly
5ffc14db755dc1032c120edd,Always quick and trustworthy!,-1,Belgium,Boozt
60be2c4cf9f4870a94b86a16,Terrible company,Terrible company. Totally unhelpful. Impossible to edit and correct ordering errors or cancel. Rubbish ....do not buy from them. Their dishonesty and lousy customer service is despicable.,Britain (UK),Wish
60dc5457f9f48706f85f39a7,unable to contact anyone via phone or…,"unable to contact anyone via phone or email, website is very customer unfriendly and not fit for purpose. Their CEO does not respond to emails, and refunds take forever if they even provide them. avoid at all costs",Britain (UK),Wish
609bb886f9f4870b700127e7,I have ordered many things from Wish,"I have ordered many things from Wish.  Most of it is TRASH!  They are unprofessionals! They do not replace or refund.  If you did not receive something, you are SOL because they will not resend or refund.  DO NOT BUY FROM THEM! THEY ARE A BIG SCAM!!",United States,Wish
5a1883bf04017d03f4c34f85,1st time I have used them and FANTASTIC,Arrived the day they said and early that day. Well packed and the quality was great. Next time they do great deals I will be shopping  at Zalando again,Britain (UK),Zalando
6094baedf9f4870a7870f992,I would give zero stars,"I would give zero stars.  I have been shopping with wish for a few years, I collect enamel pins, so I have bought many from wish.  Well, today, I ordered some items, and when I went to submit the order, it would not take it, so I was directed to support.  They told me to send a copy of my photo I would, which I did.  Well, later on today, I got a message from wish saying my account was blocked.  No explanation, nothing.  They said read their terms, and I cannot see from reading them any thing I did wrong.they charged me for items I never got, and never did anything to help me.  I took the charges off my credit card because wish would not refund them.  Now they blocked my account.  The most horrible customer service I have ever had.  There are other sites you can shop and they are less than wish.  If they keep treating loyal customers like this, they will not be in business much longer",United States,Wish
5fe7b818755dc1032c043afc,Ordered boots and returned no problem…,"Ordered boots and returned no problem as they did not fit.  However, a week later, they e-nailed saying I had purchased 3 £50 vouchers and had taken £150 from my account.  I telephoned them and they did not give a damn!!!  Do not use them",Britain (UK),Zalando
5fb36c605e693f0acceab1bc,Will buy again,"Super happy with my purchase. Fast delivery, product as expected, no hassle.",Denmark,Boozt
605ddc7df85d7508703678ea,Love Wish,"Love Wish, with a payment options added bonus 💖",Australia,Wish
60abe41ef9f4870a94abc086,I would use again but be prepared to wait,I would use again but be prepared to wait for your product. If you are in a hurry you may want took elsewhere.,Canada,Wish
5f7f3554798e6f0b94f314a4,Great quality items,"Great quality items, fast shipping. 100% recommended!",Slovenia,Boozt
57719be20000ff00096a5713,Great customer service,My package was sadly lost due to a fault with UPS and the company refunded me without hesitation. Highly recommend.,United States,Nelly
60c8fdd9f9f4870a44d59c6a,Have had to give a one star as you do not…,Have had to give a one star as you do not do minus ! I have reported I have not received my 3 item order tried to track parcel which say delivered ( not received anything)no link to contact currier I have asked wish several times (till I am blue in the face) to look into this matter to which there reply is “we have looked into this and it appears your parcel has been delivered “which part of I HAVE NOT RECEIVED MY PARCEL DO YOU NOT GET !!! So it would appear I have lost my money and all I have received is a sodding head ache so thanks for f##k all you robbing b####ds !!!!!!!!,Britain (UK),Wish
60720d9af85d75087054d0fd,I love wish,I love wish! Good stuff at a good price!,United States,Wish
58cba382ed30e309d4be35e2,zalando service,really good website you get you are delivery  within 2 or 3 days and in case of return as soon as they get the item you will be refunded of you are full amount really satisfied🖒🖒🖒🖒🖒.,Britain (UK),Zalando
5fb937b55e693f0b10fd282f,Good service,"Easy ordering, free delivery  good service overall , would recommend .",Britain (UK),Boozt
6079fc7af85d75092023cf3a,A total WISH come true,"A total WISH come true : ) great price, arrives quickly, good products, what more can one wish for. : )",United States,Wish
60d21eb2f9f48707eca7e470,ill never buy anything from these liars…,ill never buy anything from these liars again when i ordered a whiskey still i received a funnel and i ordered a chain saw attachment and got a pair of cotton gloves that will not fit nobody  i have got about half my stuff i have ordered from there and got my money back for about half of what i have not got,United States,Wish
59f3284f31302a0ef48fe2c5,Great site never fails,"Great site never fails, lovely item ,and super fast delivery cannot fault",Britain (UK),Zalando
6063d767f85d7508703f193e,It is a good online shopping app,-1,United States,Wish
5fb565125e693f0accec8467,"Very happy, cannot fault.","Great service. Cannot fault. Will happily shop again with Boozt. I bought some Gant boots for my partner, they arrived in good time, well  packaged, and much less expensive than anywhere else online. 100% happy.",Britain (UK),Boozt
6070c474f85d750870533b96,SANDLES OVER BIG TOE,I bought 2 pair of the slip on sandles.  They are junk.  They are worse quality than dollar tree.  The picture is not the same shoe.  They are very cheap material and the part over the top of foot and toe is almost cardboard.  I will never buy from wish again.,United States,Wish
5fc6413e5e693f060473c638,Dishonest and incompetent! Avoid Zalando!,"I ordered a jacket for my son which was the wrong size, so I returned it by post immediately. I checked the Zalando website, which confirmed the return had been received, and that a refund would be issued w/in 14 days. Sure enough, that did not happen. I then checked the website again and the confirmation of receiving the return had mysteriously vanished from my account details. I rang and they said they had no record of receiving the return and that I would have to fill out a legal form vouching I had returned the item...and just wait for my money back (£199.99, thank you very much). No guarantee of when they would refund me - despite having failed in their 14-day return guarantee. This is extremely fishy. Either dishonest or incompetent. Either way, I would advise everyone to avoid Zalando! You can get the same items elsewhere with much better customer service! This has been an almighty hassle and I am still out of pocket.",Britain (UK),Zalando
6034ea44f85d7509d8e1b7ac,Recommended!,Great and fast service,Slovenia,Boozt
5eb5d56025e5d20a88908005,DO NOT BUY FROM HERE,DO NOT BUY FROM HERE. I waited so long to receive my wig and it was nothing like what I ordered they did not listen to what I had purchased and sent me a wig that was nothing like the picture the hair was black and I ordered a brown wig which had blonde in it and they sent me a black wig it is nothing like the picture do not advertise something if it does not look like it in real life I am very upset with what I had received and I will not buy from her again. I am waiting on my refund.,Britain (UK),Nelly
60134883679d9701d07c096e,Good stuff,"Good stuff, cheap, fast delivary and trustworthy",Sweden,Boozt
5f056f9d3f06f20a94db97c9,So disappointed,"So disappointed, my first time using shein and my order never arrived. Ordered on 23rd June, arrival date was 6th July, tracking information shows nothing from 28th June. Total waste of money and there is no way to contact them! They are thieves!!!! BEWARE DO NOT USE SHEIN! Review amended *****Order finally arrived on 20/07/20. If you want to contact them you can get a response from IG. Hope this helps a few people*****",Britain (UK),Sheinside
591ee72220b79f0b24eff212,Great doing business with zalando!,It was a satisfying experience ordering from zalando. I had to return an item and they make it super easy. Thumbs up!,Britain (UK),Zalando
5996f09afba87f0b4c16f2b6,second time I have used Zalando....,second time I have used Zalando....I have been really pleased both times..fast delivery and fast refund if needed. I would def recommend and will use again as often better prices than in the uk.,Britain (UK),Zalando
5ff6e51f755dc107e0d9ad66,Item delivered very damaged,Item delivered very damaged. Impossible to obtain a full refund from them despite returning the item. Do not recommend,Britain (UK),Zalando
5e73c69e3c93ae0964674870,Everything perfect!,"Very impressed with ""Nelly"". This is a professional and excellent e-shop. My order arrived quickly, were just as advertised. ""Nelly"" is not only a very reasonable price but the highest quality and with excellent fast service! Very pleased to recommend and thank you ""Nelly"" for my amazing new mom jeans..ツ Five Stars ★★★★★!",Finland,Nelly
5a61fc596116dd0d6474c563,Always get stuff really quickly,"Always get stuff really quickly, love this shopping website great service even if they are out off stock if you leave your email and the stock comes in they use the service and advise you",Britain (UK),Zalando
606a8562f85d75087048443b,Wish is great,"Wish is great. Finds some very interesting stuff as well as great finds. Just wish delivery did not take so long. Being small business owner, I wait on supplies so long and in some occasions did not get them at all. Refunds are hassle-free, Wish had a great policy, just sometimes I do not want a refund, I want the products. Other that Wish is great. I am still a customer and fan. Thank you Wish.",United States,Wish
6076fa28f85d7508705c3149,Wish has great deals on anything you…,Wish has great deals on anything you can think of. Love this site.,United States,Wish
54bf0db40000ff0002c64725,SO In Love!,"I recently purchased the black long sleeve floral print dress, and I absolutely LOVE it! It has a gorgeous bohemian print, so my style. It is always scary ordering things online, not knowing if they will look as good in person, or if they will fit properly, but this dress, is a knockout! The print is exactly as shown. I am tall and sometimes have issues with fit, but the size reference chart was on point, and it fits perfectly. This dress looks and feels great. Also, shipping was fast! I am so happy with this company and am definitely going to recommend them to all my friends for cute and affordable outfits!",United States,Sheinside
60c788dbf9f4870a44d3fe2a,BAD SERVICE FROM START TO FINISH,Bought some clothing through them and then saw they use Hermes another crap company so knew I would never get them. It said they had been delivered but I never got them. You cannot get any human to talk to on Hermes so will not be using them again.,Britain (UK),Wish
5b72f4ea9d2def0b7c8d6619,Customer service and products are good👍,Read the reviews and it seemed a little sketchy but took the risk to order a bag and it came within 4 days as I payed £5 ish for quick delivery. There was a delay and I got my £5 shipping money back quite quickly. The product came the day after I got the email about the delay. The product is really good and I will be using it for school next year.,Britain (UK),Zalando
590f91b22ecbfc09e8d30508,The process for purchase and the …,The process for purchase and the delivery was all very good.  I am happy to recommend,Britain (UK),Zalando
5ae5b67b6d33bc09284c0e8f,Excellent Customer Service,"I recently ordered a parcel which was delivered incorrectly and was considered lost. Zalando could not do enough for me,  they liaised with Hermes on my behalf and contacted me daily with updates. Unfortunately they were unable to locate my parcel however they gave me a full refund for my order and also gave me a 15% voucher code to use on my next order. All the staff I spoke to via email and online chat were very helpful and resolved the issue straight away. I would highly recommend using Zalando.",Britain (UK),Zalando
601d2aa9679d970358f907e5,I love boozt.com,"I love boozt.com, the style variety and the promotions allows for us all to stay stylish  and  fabulous but the major drawback is the delivery service. They continue to use UPS whom I refer to as United Parcel Snails as it is so slow to delivery. I ordered from booze.com last week and have yet to receive my order. It has to be the most inefficient delivery service out there.",Ireland,Boozt
5c629ebe97afa10734cc4540,Worst service ever!!!,Never order from zalando ever. Ordered a parcel which was meant to be delivered today but instead I was informed that it was returned back to them. I called them but they did not seem to care about their customers since they said that they could not do anything about it. Very disappointed!,Britain (UK),Zalando
5f8358ed798e6f0b94f51640,Highly recommend,"Got some nice trainers for a good price, the delivery was super quick and the packaging was good everything came intact so will definitely be ordering more products soon.",Britain (UK),Boozt
5e121a2ec845450914b1b959,Horrible site with even worse data…,"Horrible site with even worse data policy. Impossible to remove your account without jumping through their deliberately impossible barriers. Definitely not GDPR compliant and hopefully someone will go after them soon and fine them for this dishonest, customer unfriendly behaviour!",Netherlands,Zalando
588b25aa7b45660ac8909b00,THIEVES!!! CLUELESS WHEN IT COMES TO CUSTOMER SERVICE !!! NEVER AGAIN,-1,Britain (UK),Zalando
54caf11e0000ff0002c8c413,Amazing experience every time!!,"I love this company and their products! They are all extremely gorgeous and affordable!! I have purchased a couple of pieces in the past, but just recently I ordered a white sleeveless assimetric dress and I received it just when I was meant to, and it fits wonderful! It is nice and flowy and the fabric drapes just right. Everything with the ordering and shipping went as expected and I have a gorgeous piece that I can add to my wardrobe! I would recommend buying from them 100%!",Venezuela,Sheinside
6070c42df85d750870533b4f,I DO NOT recommend Wish to anyone!,"I DO NOT recommend Wish to anyone. It took about a month to receive my items, when it was only supposed to take up to 2 weeks. My wigs looked nothing like they we are supposed to. “FALSE ADVERTISING AND VERY CHEAP QUALITY!” There is no customer service...just a freaking ripoff!!",United States,Wish
6090ca6ff9f4870a6ca4c9cb,I ordered about two months ago several…,I ordered about two months ago several items I still have not received all what I did receive was nothing like the picture. I wanted to return a item they sent me a email say take a picture of it. When I went to my account it says it been locked. So I cannot submit the picture to get my refund i am hoping my bank can help. AVOID THIS COMPANY THEY ARE A SCAM.,United States,Wish
607084a2f85d75087052c2e1,I just love wish it is easy to order and…,I just love wish it is easy to order and comes right to your door! They have a huge select of products pretty much anything you could want or need!,United States,Wish
59e9da66288eb20afc498539,Love shopping with Zalando,"Love shopping with Zalando, Always find what I am looking for at a really great price and with quick and free delivery it is even better. Only ever had one problem where I ordered my little girl a dress that should of come with matching knickers but they were missing but Zalando was very helpful and told me the dress was no longer available to order a replacement but they gave me a full refund for the dress and told me to keep the one I had👍",Britain (UK),Zalando
5f7d8023798e6f0b341ff2c2,Interesting array of products and…,"Interesting array of products and quality brands, fast service, easy returns. The company is well-managed. Would like to see photos of clothing on models, though, and be able to read customer reviews.. so the Boozt site could be improved.",France,Boozt
6066ec0af85d750870440e61,3rd item I have now ordered from wish…,"3rd item I have now ordered from wish that has not arrived, been given a full refund but I would rather get the item I would paid for than wait for weeks for something that never arrives, I certainly would not recommend them or now buy anything from them again...............in response to the wish reply...each and every time it shows on your tracking that the order reaches the UK but then never quite gets to its destination...I would rather get my order than your excuses and disappointment of not receiving what I ordered",Britain (UK),Wish
5ed15a6725e5d20a88a2d405,WILL NEVER ORDER FROM THEM AGAIN!,"I placed an order for five items on April 7th 2020 the order stopped in shipment on April 27th 2020 and did not move again no matter how often I emailed or contacted customer service demanded my money back they just kept using covid-19 as their excuse I finally received my order on on May 27th 2020 I will never again order from this company I have them blocked and they are horrible I have ordered from Etsy Ali Express in several other companies from China or overseas and in a matter of two weeks receive my items during the covid 19 pandemic. ""Side note they took their money on April 7th 2020""",United States,Sheinside
60d19634f9f48707eca7427f,Very cool product,Very cool product. Very fast shipping. I would recommend.,France,Boozt
5a184af204017d03f4c33c49,Cheapest price I could find trainers …,"Cheapest price I could find trainers and arrived within 4 days of order. Never heard about this site before, but will definately use again. A gem of a find.",Britain (UK),Zalando
57addced0000ff00097b27a9,Nice Clothes,Love their options! You can find some really good and unique items on their site. I always recommend to my friends and they are now loyal customer as well!,United States,Sheinside
59c5734031302a03bc8c3220,Love zalando,"Love zalando, great app easy to use and every brand you could want!",Britain (UK),Zalando
59f31f2931302a0ef48fdf7d,Love this site and always excellent …,Love this site and always excellent delivery,Britain (UK),Zalando
60943048f9f4870a6ca7f46d,I went ahead and ordered some clothing…,"I went ahead and ordered some clothing from this website and never received my items. According to their delivery companies listed they used FedEx UPS and USPS. I did not get what option they use ontrac for their delivery company which means I never got my items when I contacted on track they indicated that because their driver “was in the area” that they assumed I received the package. There  was no signing for a package there was no knock on my door and we have cameras, no porch theft. And the call representative seemed to laugh when I told him that I did not think I was going to get my refund because they stated that I got my items, when I did not. I think these two companies work hand-in-hand to keep the money, not deliver and put you through their “haha frauded you” hassle. It is best not to use either these companies at all because they deliberately scam you.",United States,Sheinside
5f2448341a5a6907a477d775,"Stay away, I gave them a chance even after reading the negative reviews","After reading the negative reviews I initially would not order from these guys, but I did eventually order, first thing is the order took 3 days to dispatch, I knew then I was in for problems, then the tracking link they gave me on dispatch never changed from waiting for parcel from supplier over a week later and some bull about Hermes loosing parcel, they need to actually get the parcel to loose it. In all fairness they did refund me, I suggest everyone uses Paypal to pay as these guys are dodgy and at least you can raise a Paypal claim when things go wrong. Never again shall I use this company, should have took notice of the reviews.",Britain (UK),Zalando
59a936dcf05e68079cfbc861,Good store,Good store! Good brands!,Britain (UK),Zalando
60666c80f85d750870438ba9,Worst customer service,I have been requesting for details on how to return my 12 items and received no help. It has been weeks. Worst customer service I have every experienced and I will never purchase from them again,Britain (UK),Wish
