Card_id,Header,Review,Location,shop
606869edf85d75087046252e,I love wished,I love wished. Sometimes our products are so good but for the money they are worth it sometimes they are just fun but I bought shoes Rings jewelry clothes and everything comes neatly packaged quick and on time I just love shopping wish,United States,Wish
5d8b8c923585c70a7ced42cb,"Great app, lovely products, but hassle if any issues",-1,Britain (UK),Zalando
60bd0bf0f9f4870a94b7afdd,Avoid at all costs!!!!,Do not buy! I am appalled by my first and last purchase on Wish. I bought some foliage tiles to decorate a fence panel in my back garden. The listing was advertised as 10 foliage tiles in the title and on the photos and only 1 came! I checked the listing (and prices) at time of purchase multiple times and I am very conscious of being scammed etc so I did not just leap head first into the purchase without reading correctly. Wish were quick to say I received the correct quantity and refused to help. A huge relief that I paid via PayPal as although it took a couple of months mediating between us they managed to get me a refund if I returned the item and reimbursed me for my costs. The parcel actually got returned to me which makes me wonder whether it was refused however once I reported this to PayPal they closed the case in my favour. Actually needed more than 10 of these tiles so glad I did not purchase more as they are clearly going out of their way to mislead! Avoid!!!,Britain (UK),Wish
60b102bbf9f4870a94afd54c,Stole my money,"The warehouse are full of thieves!! Every single time I return multiple items, they never get refunded. Always 1 item missing from the refund. After reading reviews i am not the only one who the warehouse are stealing from!!!",Britain (UK),Zalando
54a2b69d0000640002c0dc2c,Check Refund Charges !,"Received sweater, which took a long time to arrive.  So disappointed.  The size would only fit a child.  (one size)  I think their sizes want reviewing.  The item did not look as good as illustration.  It was made badly.  When I came to return this item and obtain a refund (from UK to USA) it costs more than the actual item with tracking.  I would say avoid this company if you do not want to feel like I do at the moment.  The sweater has gone off to the Charity Shop.  To be fair they did offer me 50% discount but this is not good enough.  I would say beware if you want to return item for refund !",Britain (UK),Sheinside
59970422a64b4105d8355cf1,Simple and quick process with super …,Simple and quick process with super speedy delivery! Will use again,Britain (UK),Zalando
5672bc550000ff000925f49a,Excellent service!,This company really cares about their customers. Fast and informing service. I recommend buying on nelly to anyone who loves cloths.,United States,Nelly
60588c97f85d750bf4fb9b5a,Not even one star,"Not even one star. Totally useless and miss-leading. You see a price, try to buy it and price doubles or more. Waste if time. Use AliExpress or similar instead. This is just a poor attempt at a Chinese wholesale site but retail pricing",Britain (UK),Wish
54d2f8cf0000ff0002ca59de,Perfect Fit,"I ordered the gray diamond pattern sweater. Not only was it on sale, the fit was exactly what I was looking for. I love that it can be dressed up or just causal. It is comfortable and functional. I opted for the standard shipping and received my purchase fairly quick. I had no issues with this order and am extremely happy with this purchase. I would highly recommend sheinside to anyone. My only issue was how long the estimated time of delivery was. It worried me to have to wait 28 days, but I received my order much faster.",United States,Sheinside
6035f3edf85d7509d8e299b9,great offers,"great offers, great products. delivery takes a little longer than you would expect in Europe, but all in all I would recommend it",Germany,Boozt
545a17b70000640002b19291,Excellent service dealt with very proffesionally,"Had a faulty Item, Was offered a percentage to keep it, decided I wanted a full refund. Easy return process and dealt with expertly by the customer service team, Great service all round, will continue to shop with Zalando in the future",Britain (UK),Zalando
60991a86f9f4870a0c70cac3,A++++ perfect service,"Ordered nike trainers I wanted that I could not find in my size on any other website , ordered them Friday afternoon and they were delivered Monday morning.  Perfect fit and lovely quick delivery . I was dubious as had read a few bad reviews but Highly recommend. Would definitely order from them again",Britain (UK),Zalando
60b952f8f9f4870a94b57e8a,DO NOT WASTE YOU TIME OR MONEY,I never received my last order (Wish confirmed this) but they refused to refund or replace.  They blamed me for not contacting them within 30 days.  I just received my other order already in process. (took 5 weeks).  I ordered 2 3x shirts and 2 4x shorts.  The shorts are no bigger than a men's small and the shirts are the same. (Way to small).  I like my clothes a little baggy but instead I look like the hulk.  It will be easier to donate the items vs. try to return them. I am deleting the Wish app after this survey.  NEVER AGAIN!!!,United States,Wish
53f4f69b0000640002a02427,Great online shop! Great service!!,Something went wrong with my payment. So i had to pay 40 Euros extra. When i explained the situation they sent 40 euro's back to my account. I would say that is a great service!,Netherlands,Nelly
604d4ad0f85d75064c40cd46,ORDER SENT BACK TO SENDER,I ordered a package from SHEIN and my package was supposed to be delivered but apparently it got sent back to the sender. I tried to contact DHL in regards to this but they could not help. I could not get in contact with SHEIN customer service because its a robot. I want a refund but I cannot get ahold of anyone. I have ordered since this and had no issues.,Canada,Sheinside
6081a1ebf9f48701fc7aa9eb,Great page design,"Great page design, great service, and fast delivery! Would recommend it to everyone.",Austria,Boozt
5c93f9c097afa1097c6ab0f2,Love this site!,"This website is great for clothing, great brands and their own label clothes are awesome as well. I Have shopped a few time and delivery has been really fast to NZ. The one time i had an issue they provided outstanding customer service and resolved it within a day. Highly recommend :)",New Zealand,Nelly
60776bbcf85d7508705d35e6,Love the site,"Love the site, shipping a little long sometimes, but otherwise great products!",United States,Wish
5e46ee143c93ae08649fb852,Love the pop up store,Love the pop up store. So many things to choose from,United States,Sheinside
606cb6ecf85d7508704bfc7c,Love Wish,"Love Wish , just wish it would not take forever to get items",United States,Wish
5ef3c91a7dd753032475348c,I would rate this zero stars if I could…,"I would rate this zero stars if I could. I placed my order April 28, 2020, and I did not receive my package until June 4, 2020. Two of the items I received in my order, were not apart of the items I had selected initially. When I tried to return the items, it says that the items are not eligible to be returned. When I connected customer service, it was no help. Now I am stuck with items that I did not want, and I did not originally order and Shein does not seem to have any record of what I originally ordered. Shein, also does not have a customer service number that I could call, there is only an online chat option, and that was absolutely no help. I will never order another thing from Shein, ever again, this was a horrible first time experience.",United States,Sheinside
542df3470000640002a9c5ac,I JUST WANT A REFUND,I got my order after 4 weeks. When I opened my packaged I was so excited only to find out that my clothes REAK of paint thinner and gasoline and have made my physically sick. The clothes were awful quality like someone quickly put them together. The sizing is completely off. I ordered 2 medium skirts and they will not even fit my 100 pound friend!!! The sweaters were fraying. I also did not even receive a receipt. The only form of documentation I got was 2 pieces of paper saying I ordered 8 red sweaters which is completely inaccurate. I just want to return my items and get the refund I deserve but no one will email me back with the steps I need to take to return it or even the return address!! I do not recommend this website to anyone its a SCAM and horrible service. I cannot believe I wasted my money on this type of service!!!,United States,Sheinside
5bf96e129d37800358222370,Definitely recommend,"Definitely recommend. Fast and free (according a price) dilivery, quite satisfied.",Denmark,Nelly
54b679090000ff0002c481cb,Very disappointing,"I order several items from Sheinside, over two months later I had not received the order, nor had I heard anything from Sheinside. I have recently been informed there was a problem with the delivery so they can reattempt to send my order or give me a refund of only 70%. I no longer want the clothes, and being offered only 70% refund is outrageous as the delivery problem was not on my behalf. I would not recommend this company.",Britain (UK),Sheinside
60a55ffcf9f4870b7008ab6a,Do not buy,When our item did not arrive they asked if we wanted to wait longer due to CIVID 19.  we agreed . when the item still did not turn up we asked for a refund and they said we had passed the one month cut off date for a refund so were not eligible.,New Zealand,Wish
605f9e57f85d750870392c7c,Fore those who are fortunate will never…,"Fore those who are fortunate will never shop with wish.com advert show genuine products that you will never receive,wish.com will never resolve or even reply your email, I have ordered genuine Moissanite Gem and I received piece of glass, please be careful with wish.com",Britain (UK),Wish
6080293ff9f48704b8fa1489,Looks like a scammy web services,"Looks like a scammy web services. I saw a product with a discount and ordered. But it pulled out the full amount not the discount. They are cheating like that, please be careful. Stay away from this type of web sites.",Azerbaijan,Wish
54b799660000ff0002c4bef9,Just What I Needed! Wonderful Experience,"I am an online shopping addict and I must confess sheinside is great and an amazing site to order. Placing an order is easy as 1,2,3. The service is just awesome. I ordered a present for my sister's birthday, my order came so fast and I was amazed. It was much better than I expected. As I told before that I am an online shopping addict, and I can surely say that the prices I found on sheinside were less than all other online shopping sites. The prices are affordable and everything is great, so I recommend everyone to use sheinside before trying any other.",Pakistan,Sheinside
5dc3de4a604858093c23c907,Absolutely amazing experience,"Absolutely amazing experience. Always. In the near to 10 years that I have been using Zalando in 3 different countries now, the service was always quick, totally hassle free and very reasonably priced. I have only ever had one mishap and Zalando fixed is so quickly, with such great extra customer care, I was seriously impressed. Can only recommend.",Britain (UK),Zalando
5840467390ef760a18974b2b,Amazing website,"I purchased twice and I was very happy with what I got. I love this website and I trust them. Because unlike other chinese clothing stores (like Rosegal for example) they actually ship your order. You just have to be careful with choosing the clothing, always look at the dimensions!",Serbia,Sheinside
607aa4adf85d750920240ecf,Reliable and fast,"No fuss, fast delivery, good campaigns. Recommend.",Sweden,Boozt
60690900f85d75087046f170,I enjoy wish products and prices,I enjoy wish products and prices ! It is been my go to for online shopping !,United States,Wish
5549060a0000ff0002e2e98d,Shoddiest Operation Ever,"I was stupid enough to order from them three times. My first order took a month or so to arrive. I have been waiting for my third and final order to ""leave operations"" since April 25. I have submitted tickets regarding various issues, and received a very nice form letter response that addressed none of my issues. My second order actually arrived in a timely manner, but upon looking at my purchases, 50% were such garbage quality that I wear them to bed. When I addressed the sub par quality issues, surprise! Another form letter. I would not bother with Sheinside. There are far better websites to shop from.",United States,Sheinside
60d0d729f9f48707eca6e7e2,Extremely good shopp,Extremely good shopp. Very fast delivery. Only 3-4 days and you get your item. Like it very much.,Sweden,Boozt
602960fd679d9708b4d6004f,Boozt.com is great because their… shipping is fast,Boozt.com is great because their shipping and handling is very fast,Lithuania,Boozt
608c3938f9f4870984b0917a,After ordering a product from wish…,"After ordering a product from wish ($125) I had to wait 21 days for delivery, not a problem. The day the package was updated to out for delivery I was waiting at home, post office delivered mail (letters, magazines) but no package. Shortly after the package was marked as delivered, I contacted wish immediately and informed them of the problem and that I have not gotten my package, I was told to wait another day or two. I waited 3 days and still no package, when I went back to them about a refund I was told to go talk to the post office, post office does not have anything nor will they give me a paper that they do not have it. So here I am almost 2 weeks after the issue and still no refund. $125 out the window because wish apparently does not refund a package that was delivered. I do not recall sending my money to the post office for them to deliver my product. I sent it to Wish and they should be responsible for delivery problems and deal with the post office not me. If you ask me wish is a total joke!",United States,Wish
5f91328e798e6f0aa0ab6a20,super,"super service, suepr my boots",Italy,Boozt
58cc54c0a912c40a44ce2b17,Great website,"Quick delivery, quick refund for returns.",Britain (UK),Zalando
576cb5b90000ff00096941a8,great company,"they have fast customer support service, and they offer a nice items",United States,Sheinside
5f1a82ba1a5a69075065ff1c,Exorbitant cost,"Horrible customer service and the refund cost are more then ridiculous €9.95 and paid €4.95 already to get it here. Expensive sale article €21 for a bag and then all these costs, no more Nelly for me.",Netherlands,Nelly
5931680ba02b4205a0c02154,Excellent service,Excellent service and a great price! What more do you need. Will definitely use again.,Britain (UK),Zalando
5f2803461a5a6907a479725e,Item not received,I placed an order on the 26th June 2020 and I still have not received it! I did receive a completely different item that I did not pay for which might have been sent by mistake. I have tried various ways of contacting them to resolve this and get a refund but it is just hopeless! So frustrating. If this does not get resolved I will no longer be a customer.,Britain (UK),Sheinside
5842b9b632be350888ebc568,No delicert and no contact,"I have had such a bad experience with zalando, I ordered a top for my daughter to wear for her 18th birthday and it was due to arrive two days prior to this, I had an email saying it had been posted through my door by hermes which it had not, I contacted both zalando and hermes, and all hermes said was that it more or less was not their problem and it had nothing to do with them, I have emailed zalando around ten times now with my complaint and I still have not even had one reply, I think this is a disgraceful way of treating customers as I was left without a top for my daughter to wear when her birthday came and went three days ago now and I  STILL  have heard nothing, bad practice and bad manners by zalando. I will not be ordering again.",Britain (UK),Zalando
59b1543b31302a083058e73c,Zalando is the best.,"I have ordered from Zalando lots and lots of times and never experienced any issues. Delivery time is always quicker than expected and quality is always good. The one time I had an issue regarding a refund that I was waiting for, I spoke to Bella at Zalando Customer Care (Bella_ZalandoCustomerCare). She was fantastic and sorted my problem out instantly. Very friendly and helpful. I will continue to use Zalando as my main online shopping place and I recommend it to everyone!",Britain (UK),Zalando
60c9e2a5f9f4870a44d63ab3,I have bad experience with SHEIN they…,I have bad experience with SHEIN they did not refund my money even I give bank statements sttil no refund.. The customer service refused to answer to all my questions... They are to much bad and not honest and a thieves... Do not buy from SHEIN,Saudi Arabia,Sheinside
58cebeefa912c40a44ce775b,great free service,Fast free delivery and returns that I can highly recommend,Britain (UK),Zalando
605fce04f85d750870395103,Arrived on time beautiful sound and…,Arrived on time beautiful sound and great in shape love it thank you wish!  I will order more for all my families.,United States,Wish
605ffba0f85d7508703960fc,Love wish,Love wish. Can find anything I want,United States,Wish
5a184b7504017d03f4c33c7d,Great company.,Really great clothing.Plenty of brands and easy to shop and good  customer service.,Britain (UK),Zalando
606500e4f85d750870414710,I have no problem with Wish,"I have no problem with Wish ; I just wish I could actually talk to customers services, however I will continue to order from Wish . 👍👍😍",United States,Wish
5aa666e5d5a5700b641ab41b,Return,They helped me with my return and did not charge me for it since the hat i got was of poor quality. The helped me on the online chat and i was immediately helped! Good site!,Sweden,Nelly
5cc2bdf2a8436908c40f1fd6,Great service,"I can see a number of very mixed reviews on Trustpilot which surprises me as I have always had a very good service and and decided to comment today as I have been refunded for an item which I only dropped off at the service point yesterday! I think this an incredibly efficient system and I have ordered regularly for a few years now. I find the site has a wide range of clothing and accessories, often very well-priced; orders are quickly despatched and received quickly. As I do order quite a few items, some have had to be returned and I have always had far quicker refunds with this company than several similar ones. As I will comment on poor service, I think it equally important to do so when things go well.Thanks, Zalando, this time you have really excelled!",Britain (UK),Zalando
5fd3b663755dc10b481f976e,Came on time,"Came on time, I ordered a superdry coat, it was too small. so I did a refund and got my money back. Service was very good, they are legit. I have no idea why the reviews are so bad.",Britain (UK),Zalando
60e4ac9af9f48702a8926b73,All products arrived in perfect…,"All products arrived in perfect condition, as well as well packed. Shipping took 5 working days as expected, got a link that I could follow my parcel in real time. The app and website is very well built, easy to order. Would recommend this company based on my first time experience with Boozt.",Finland,Boozt
60b2d522f9f4870a94b0e6ed,This is the worst website I ever order…,This is the worst website I ever order From I spend 476.00 worth of stuff and only received 3 item from 476.00 worth of stuff I order this does not make no sense to me like they do not have a contact number so People can call them I was told they was good but the shipment comes late but they did not tell me you only receive only a few items of your order like I am very mad of customer service are not replying back or nothing they keep sending me the same thing like people that is not what I am asking or looking for the right answer or question now I am like where is refund money now still waiting for answer please do not order from them if you are not got a house address  do not place a order because you gone be mad like me i had a P.O. Box you think it will be a good thing to use instead of your home address I guess not then they tell me I have to wait until May 22nd thur June 21st then they going to refund my money why Do I have to wait 2 month’s for my refund I been waiting on my order since the end of March and only received 3 items like when can I get my refund and they only allow you to enter one id number when I have at least 20 items still out there and my stuff got ship to some where way in New York at the Brentwood New York I am way in Florida and they send it to Florida but to the wrong P.O. Box if they look and send where they send my tablet and pink case and mask maybe I receive all my package 📦 they keep sending my package to the wrong PO office and the po office staff keep sended it back all they have to do is look at my account and they send where my packages goes because all my stuff is at Brentwood New York Company and I do not even know how to contact them to to give them the right address I so mad 😡 😡 wish need to be closing down like frfr,United States,Wish
6075b114f85d75087059f3d5,Be careful about this place,"Be careful about this place. if you want cheap, you sure are going to get it.",United States,Wish
59c4d73831302a03bc8bfdb2,Still not got trainers and they were …!,Still not got trainers and they were for her birthday delivery attempted three times but never left note and cannot get through to courier vvvv dissspointed going to Nike shop today 1 1:2 out of my way because it is my daughters birthday and she has not got her present - first time and last time,Britain (UK),Zalando
606e4a88f85d7508704eb82b,"Wish is not good.It took many weeks for a parcel to…promises to get back to you in 2 or 3 days. They ask for pics of packaging, which will not send on their reply options. It seems pot luck with Wish.","It took many weeks for a parcel to arrive. When it did, 2 pair of track pants were missing, and i recieved a package which should have gone to someone else, and is useless to me. Wish is impossible to communicate with, with cheery promis",Australia,Wish
5ff66c0a755dc1032c0e3eb4,My stuff arrived 2 weeks earlier than…,My stuff arrived 2 weeks earlier than they said to expect and in great condition for the price definitely ordering again!,New Zealand,Sheinside
608926a3f9f4870984adc54f,I have ordered over $1000 worth of…,I have ordered over $1000 worth of products from SheIn in the past 3 years. Have not had any problems receiving what I ordered. Only a few products that I got were not up to par. And what I returned was easy to get my money back. I also like the point system and coupons. And have actually gotten free clothes by doing this. I did the math once and saw I paid less than $10 on average for each article of clothing I bought. Plus a number of times throughout the month they offer free shipping. I lost 30+ lbs and needed new clothes and am great full for how this company is run.,United States,Sheinside
6092fa08f9f4870a786fa0a0,A bit delayed but otherwise perfekt,"When I made my order at Boozt, there was automated info about possible delays, times being what they are. I was in no hurry, but after Bring did not change the status from my delivery being either at the seller or on it is way to Bring, for several days, I got a bit worried. Did not help to read some bad reviews right that moment either! I wrote the customer service asking about the situation of my order. Before they even had time to answer, I had to write again the next morning to inform them that I received my package. Seems like it was Bring that had problems with status updates. I got all I ordered and every product as expected, no complaints. Instead of just ""Good to hear, have a nice day"", the customer service answered fairly quickly and very friendly, not with just some standard totally automated response. They answered directly to what I wrote and apologized for the inconvenience. I am a happy customer and will easily order from Boozt again!",Sweden,Boozt
5fb6b4865e693f0b10fb3d66,Superfast delivery,Easy to order and super fast delivery! Will use again!,Denmark,Boozt
607a0206f85d75092023d273,Do not Do It!,"Really do not know why people use this site or how they receive products. I have been waiting 2 months, forgot what I ordered, of course you CANNOT cancel the order either! Banks been fighting them for weeks for my money. Trickling in couple $$ at a time. Not the $42 I stupidly ordered from them. Reported to BBB. Save your 💰",United States,Wish
5e1a958dc845450914b62ac0,Be Warned...,"Be Warned.... Do not expect to receive a refund for your returned item. Having to contact Customer Services, complete the “Legal Statement” form and provide proof of postage is both frustrating and time consuming, definitely not an experience I want to repeat. Zalando’s refund process is shockingly bad, a retailer to avoid....",Britain (UK),Zalando
5a4a5159a5b32906885e494c,Fantastic experience with Zalando,"Fantastic experience with Zalando. Had 4 different orders recently and navigating through the website was no problem, well stocked on popular items, delivery was very speedy and constantly informed of status. I also had to wait on an item coming into stock and this was dealt with very professionally. Highly recommend",United States,Zalando
5a184a2bc0c9900ddc5932b3,Was very unsure having never used to …,Was very unsure having never used to site before. Only purchased via a google search for a certain bag. Item was as described. Delivery and purchase was simple and fast. Will be using this site again,Britain (UK),Zalando
6056a5d5f85d750bf4fa7f44,Great store,"Great store, Great products. A+++",Cyprus,Wish
