Card_id,Header,Review,Location,shop
5fd2387c755dc107e0be6c1b,Terrible customer services,"Awful experience, I ordered some trainers which were lost by Hermes. I Emailed customer services to which I did not receive a reply for a couple of weeks. When I eventually got through to live chat I was refunded without being given the option to have a replacement sent. When asked about this I received the response 'we do not offer automatic exchanges' when I reminded the agent they lost my parcel the response was 'my mistake, I suggest you reorder'. I will be reordering but not from Zalando.",Britain (UK),Zalando
605fe24df85d750870395937,Warning,Warning: addictive!!! Prices have gone up some.,United States,Wish
592017d2a02b42090067978e,Fabulous !,"Cannot fault Zalando at all,  easy to use online and product was great and delivered on time !!! Would I use Zalando again "" Definitely "" x",Britain (UK),Zalando
5f9c15195e693f06f8759ddd,I placed an order 4 weeks ago still…,I placed an order 4 weeks ago still havnt recieved and when I track my order it says it is been delivered it has not been delivered no help what so ever discusting company do not waste your money,Britain (UK),Sheinside
553970a80000ff0002dfc83c,Not impressed,"I placed an order about 5 days ago, and it is still processing. I paid for the fastest shipping available, and their customer service told me that they still cannot guarantee that I will receive it for the event I need the dress for, late next week. They also told me yesterday that my order was ready to ship ""as soon as possible"" but still says processing online. What am I paying shipping for if they cannot guarantee it will be here in the advertised amount of time?? Do not think I would rely on this website if I need something for a specific date again.",United States,Sheinside
5f8c3143798e6f0bcc48767f,Reliable Good value and speedy,"I was looked for Ugg’s slip on suede shoes and these had the best price, delivery was very fast and I recommend them.It is the first time I have used them but will definitely use them again !!!",Britain (UK),Boozt
5e33634f3c93ae0b249a9d26,Extremely Slow Dealing With Returns,Sent back 3 parcels to 3 different companies at the same 2 have completed the returns processing and the money is back in my account but I have not heard a thing from Zalando after 2 weeks. This would put me off using them again.,Britain (UK),Zalando
599db6caa64b4105d836d4fc,Horrific customer service skills.,"Horrific customer service skills! In 2017, you would expect to be able to pay online via card payment but oh no! And when you contact customer services, you get greeted by somebody telling you they cannot assist you about adding card payment rather than PayPal, even though the website clearly states you can. If you ask to speak to a superior, you will rudely be told no, and informed that they know as little on the subject as you. If you ask to speak to anyone in regards to the matter, they will tell you that nobody in the whole company, an online one may I add, knows how to advice you on making a card payment to a website based clothing store. An absolute farce. I will be taking my custom back to ASOS and advice you all to do the same.",Britain (UK),Zalando
554967c90000ff0002e300e3,Terrible with returns!!,"I ordered 11 items and none of them worked so I am trying to return them. However, it takes days for them to get back to you and they are not giving me the information I need in order to get the items returned! It is an infuriating process and do not recommend ordering from them!",United States,Sheinside
60b45cecf9f4870b7012cda4,Order with wish and get worse then a dog dish!!,Wish is the worst company l have ever known the rubbish that l received was unbelievable the jumpers l ordered in the picture were really nice l ordered two blue and pink and they said they were 80 percent off red flag l guess!! They were priced at 8 pounds each but after the order had gone through got email saying 84 pounds l mailed the co immediately no reply and none of the contact phone numbers worked l could not believe what l received two blue awful quality tank tops? with holes everywhere and l do not know what to say they are out and out crooks and l am begging you not to waste time or money looking at their website they should be shut down immediately put one star but really you should a minus star score and for me that would  be infinite,Britain (UK),Wish
596060e7dacd1d00980ffbf0,Poor service,Ordered 2 items on the 1st of July and said would be delivered waiting 2-4 working days. Emailed them several times and they said it had been delayed and would be dispatched witihin 1-2 days. Called them yesterday twice and both women said it would be dispatched yesterday night. I have checked my emails and my account on zalando and it still has not been dispatched which is very shocking as it has been over a week and I have not been given a valid reason on why it is taking so long. Will not be shopping with them or recommending them to anyone again.,Britain (UK),Zalando
593155e120b79f0a909ad0e1,Great first time service ordered on …,"Great first time service ordered on Sunday of bank holiday weekend my gorgeous ted baker shoes arrived first thing Wednesday, would definitely order from you again x",Britain (UK),Zalando
5f7de9b0798e6f0784a7eecc,HORRIBLE HORRIBLE DO NOT PURCHASE,"HORRIBLE HORRIBLE DO NOT PURCHASE. THIS JUNE I PLACED AN ORDER THAT WAS ABOUT $60 AND I WAS EXTREMELY DISAPPOINTED WHEN IT DID NOT ARRIVE. I ASKED THE POSTAL SERVICE IF THEY HAD LOST MY PACKAGE AND THEY TOLD ME THAT THE COMPANY THAT SENT ME THE PACKAGE DID NOT SPEND ENOUGH ON SHIPPING TO GET IT TO ME AND SO SHEIN DECIDED TO DESTROY THE PACKAGE INSTEAD OF HAVE IT SENT BACK TO CHINA. I SHOULD NEVER HAVE PURCHASED ANYTHING FROM THEM TO BEGIN WITH, BUT I WAS LOW ON CASH AND REALLY WANTED A BATHING SUIT. I tried to contact the company and get a refund or at least an apology and I received nothing, not even an email. The entire company is based off slave labor. Please do not be as stupid as me and try to order from them.",United States,Sheinside
59f5c1fbdc938904f8e2bf4f,Zalando is the best,Zalando is the best. Great products that you do not find everywhere else. Great prices and the customer service is outstanding.,Britain (UK),Zalando
59e9d92831302a0ef48da183,I have only purchased one item from …,"I have only purchased one item from Zalando but I will not hesitate to order from them again, as the item arrived on time  and  was exactly as described.",Britain (UK),Zalando
576d417f0000ff00096964fc,Love this store,I really like the wide selection this store has to offer at a good price,United States,Sheinside
57cf0ac00000ff000984dec0,Not Straight Forward With Their Shipping,"I ordered a skirt last Sunday under 6 - 8 shipping days. The skirt also said that it is available to be shipped within 24hrs. On Monday morning I received an email saying that the item was shipped. I thought, oh great! however for a whole week now fedex tracking number has labeled created. I bought this item for an event on the 12th was hoping to get it by the 11th. I am extremely worried that I will not get it in time. I have no use for it after the 12th. This is very frustrating. When a company writes that it ships in 24 hrs and shipping takes 6-8 shipping days; that should mean that at the very most the item will arrive in 9 days!!!!!! This is very disappointing because this was my first time ordering through this website and if the item does not come on time, then I will prob. never use it again. #disappointing",United States,Sheinside
5f8ae0af798e6f077061082c,No complaints,"After reading a lot of the negative reviews about Zalando, I went ahead and bought a pair of boots from them anyway because I could not find them anywhere else and the main problem I read about was the customer service, as opposed to any scammy behaviour. I am so glad I did, because Zalando smashed it. The boots arrived quickly, are beautifully packaged and absolutely flawless. I am not trying to discredit anyone else's experience with Zalando, but just want potential shoppers to know that it is not all bad.",Britain (UK),Zalando
551596d20000ff0002d868ca,Great Online Shopping Site,"I was very nervous about ordering off this site because of some of the other reviews that I read about this, but the prices are so fabulous, I had to give it a try. I ordered the Red Spaghetti Strap Slim Chiffon Dress. The site states that it takes roughly 7-10 days for processing and then up to 28 days for shipping, so I planned ahead and did not expect the dress for a while. It arrived roughly three weeks from when I purchased it. I was very pleased with the shipping, especially since they noted how long I was expected to wait. The product was as described on their site and I love it! It is the perfect summer dress for a special occasion.",United States,Sheinside
6009c4c3755dc104c0c4edcd,Great price great service highly…,Great price great service highly recommended,Britain (UK),Zalando
5da5949260485807e8b25952,I really recommend this shop,I really recommend this shop. Fast and friendly contact with customer service.,Poland,Nelly
59214a33a02b42090067c2aa,great service placed order friday …,"great service placed order friday morning and received order monday morning, would defenitely use this company again",Britain (UK),Zalando
591ee74f20b79f0b24eff222,Really good company to deal with from …,Really good company to deal with from delivery right down to good customer service.,Britain (UK),Zalando
5f795d23798e6f0b341dabd2,Fast  and  reliable online seller.,-1,Croatia,Boozt
5624f9d10000ff0009124709,terrible,"Was given a three hour window of delivery, waited in. Delivery driver knocked on door but waited less than 30 seconds before leaving so I did not get to the door in time. Was informed that delivery could subsequently not be made until the following Monday, but I explained we were going away and asked for them to arrange for it to be redelivered the same day (as I first contacted them within half an hour of the attempted delivery the driver should have still been relatively nearby). They said they had contacted the delivery company (hermes) who refused to redeliver before Monday. They (Zalando) told me they had made a decision without asking me,  to instruct Hermes to return to sender and claimed they had refunded the item. I wrote to explain to them I had in the interim time postponed - at great inconvenience and some expense - our trip to be able to be in on the Monday. I had no reply. Tried again, no reply. I decided as the original order was going to be returned to sender to simply reorder the item as we now would not be going away until Thursday - after I had done this I was informed directly by Hermes that the original order was now out for delivery totally contradicting what Zalando had told me - as we were no longer expecting any delivery on the Monday I had not stayed in and subsequently missed the delivery. I wrote to Zalando to ask what was going on and for them to rectify the situation - I asked them to make sure that the reordered item get to me by Thursday having already been put through an awful lot of incnvenience, messing about and stress as well as expense. The lack of care, responsibility or organisation is staggering. I presently am now in the situation of having two of the item in question on order and having postponed a trip and do not have any way of knowing if or when either of the orders will come as Zalando have stopped replying to my emails. I have never been messed about by any company in such a way. It is ridiculous.",Britain (UK),Zalando
60305432f85d7509d8dead54,Ordered 2 items from Boozt,"Ordered 2 items from Boozt, arrived quickly and everything was well packed and just like on the website. 5 stars to this site, one of the items was on discount 50%. In the future I will definitely buy again from this online store. Thanks !",Croatia,Boozt
60ad3613f9f4870b700e2547,Beware of Wish,I  am a long time shopper of online shopping.Wish was my worst shopping experience online. They put me through hell for them SENDING me the wrong size and the same kind of 2 dresses. I was put through so many questions about their mistake. I will never buy from them again. They tried their best not to refund me my money. I would give a zero if I could.,United States,Wish
60b02792f9f4870a94af3bb5,The products are cheap and are not of…,"The products are cheap and are not of good quality. Descriptions of the products on their site are not accurate and they are phrased to seem better than the products are, VERY MISLEADING.  PURE JUNK!!!!  Not worth the money!!!",United States,Wish
5ade315c6d33bc032092e77f,I placed an order with zolando for…shoes for a wedding,I placed an order with Zalando.co.uk  for shoes for my sons wedding the service I received was fantastic I will definitely order from them again many thanks ps..super quick at answering my emails as well,Britain (UK),Zalando
5cb5df2fa843690a7cc5b3c4,Unsatisfactory,Ordered for the first time. They put a hold on the cost of the order but never actually placed the order. I then had an email from them saying that the items I thought I had purchased were still in my shopping basket. I nearly paid for them again except that I checked my bank account and saw that the money had been taken. It was returned 3 working days later. When I contacted them to ask about all this they told me it was standard e-commerce practise however I order online a lot and have not had this experience with any other retailer. I found the experience to be frustrating and misleading. I will not order again (even though I really did want the dress),Ireland,Zalando
60702e59f85d75087051de8c,A terrific resource for nearly anything,"I have used WISH several times for a vast variety of products such as clothing, equipment, tools, home cleaning supplies and PPE items. I love it.",United States,Wish
5f50f75e02e85708c8df081a,So far I have had no issues with SHEIN I…,So far I have had no issues with SHEIN I received all my items and the quality and sizing has been amazing. I live in the uk 🇬🇧 and I have had no issues with deliveries. Hopefully this carries on has I am a big shopper with them now .,Britain (UK),Sheinside
545d544f0000640002b24bb5,Excellent sevice and stylish clothes,"I am known as a very shopaholic woman but due to lack of time I cannot go out shopping very often. I came to know about Sheinisde through one of my friends and since then shopping has become very easy. I love the collection at Sheinside and one very attractive feature is they offer you a great discount without compromising on the quality. Which is great for people who love to save a few bucks. The skirt i bought is exactly like the image shown, Great skirt, The delivery was on time, even early. The products are high quality and the customer service is very helpful.  This online store has great designs and brands along with a very unique  style. This site is highly recommended for people with a different sort of fashion sense. Excellent shopping experience.",United States,Sheinside
5f993ba75e693f06f8737b4e,"Excellent quality pieces, good service, timely delivery","My order arrived on time, consisted on the item I purcahsed that are of high quality. As usual! Boozt never dissapoints me!",Estonia,Boozt
6032cc30f85d750b989c5ec2,Do not order from Shein,"Do not order from Shein.  They take your money and you never get the product.  No email, no notice, nothing.  It is a scam.",United States,Sheinside
6062fbb8f85d7508703d7a56,Love wish l like the service they…,Love wish l like the service they provide to Thier customersalways keeping us informed our deliveryitems good quality considering the process glad lJioned others to buy items from them,Britain (UK),Wish
605cafcef85d75087034932b,Love wish bits got everything!,-1,United States,Wish
60a2d953f9f4870a94a53a02,SCAM!!!! WARNING!!!DO NOT SHOP HERE,"The couple of items that I actually did receive were complete garbage. Totally stretched out, I ordered a large it fit like a 2x. Another item I ordered 3 of the same shirt all the same size, large, one fit like a small one fit like a 2x and one was not even the same item. Then my order states that one of the items was cancelled, but I did not cancel it and was charged. Three other items I never received but was charged for all of them. They shipped half my items to another address and then I got charged a re-stocking fee because I never picked them up, but I have no idea where they even were. I contacted my credit card company to dispute the items, and Wish said I received everything which is untrue. WARNING DO NOT SHOP HERE!!! IT IS A SCAM!!!!!!",United States,Wish
604ed444f85d75064c41826d,Safe and good,"Shipping times are decent, I always order from shein and my stuff comes within 1-2 weeks.  The quality depends that is why I usually read reviews and look at photos but overall shein is a safe website and reliable.",United States,Sheinside
606a9c9ff85d750870484c83,They have it all,I love wish. I have ordered many items and have had all good experiences thus far.,United States,Wish
60a7ec3df9f4870a94a9693d,Placed a few orders with this lot,"Placed a few orders with this lot. I found that most of the items were cheap tat, depending on what your buying. Took about a month to arrive on most of the orders. Packaging was very substandard and app is not that good either cannot get any answers or the information given is not correct. Probably best avoid wish.",Britain (UK),Wish
60420846f85d75064c382dd1,Dorothy,Very high quality and beautiful workmanship. Perfect size and fits perfectly on the body.  I recommend highly,Ireland,Boozt
58cb9fb2ed30e309d4be3522,Fantastic!,Zalando.co.uk is the best online shopping experience I have had. Everything about the website is so customer friendly. I will continue to shop with them.,Britain (UK),Zalando
5fd898f5755dc107e0c39d4d,excellent,"i love this website, very nice customer experience and i get the orders immediattelly.",Slovenia,Boozt
605ccde5f85d75087034e3f0,Most time I receive my items early or…,"Most time I receive my items early or on that day. I have had only on late item but, other than that I love the app.",United States,Wish
60a9c1f0f9f4870a94aa67a3,I would order it again,It was like I expected it to be,United States,Wish
5fc917075e693f060476bddb,5 Stars because they deserve it,"First of all, I did not even know that boozt.com exist. I found it on Google accidentally when I was searching for a specific parka. When I checked for the first time the site I thought that it is items are not genuine because the prices were a bit lower than the competition. But guess what. Their items are 100% genuine. I have just received my parka and its 100% original. The price was great but the most important was the delivery. The parcel took exactly 1 week from Denmark to Greece during Black Friday week. When they called me from the courier to receive my package I was shocked because I have order so many things during this week and none of them have arrived from mainland. Not a foreign country like Denmark! I highly recommend boozt.com and will definetely buy from them again in the future.",Greece,Boozt
58e659bed744950408c26a10,Great company free delivery and returns …,"Great company free delivery and returns, quick response to any queries. Have used them several times will certainly order from them in future.",Netherlands,Zalando
53fc8eb50000640002a151dc,Fabulous time ten,"I liked some of the featured jeans so decided to give this site a try. I am always wary about trying new sites and was pleasantly surprised. The jeans and blouses are really really good quality and the price was fantastic. Order was delivered quickly and accurately. The selection was diverse enough that a 8 yr. old boy, teen, and adult mom could all find everything they want/need so you are not going from one site to another and picking up packages at 4 different times. Going back later looking for a dress for a specific occasion after giving up on the mall options I was happily surprised again by finding not just one that looked great but two. Excellent site, easy to order from, quick delivery, and great selection make this a goto place for me.",United States,Sheinside
60ac37c0f9f4870b700d4ebe,Love the wide variety of items you can…,Love the wide variety of items you can order. Sometimes orders take a long time but mostly your item comes on time. Very happy with my orders so far and would recommend wish to anyone who loves a good bargain. Thanks Wish.,New Zealand,Wish
60a4e897f9f4870b70081564,Boozt it is nice shop and they are…,"Boozt it is nice shop and they are serious, and fast transport. Thanks for everything.",Norway,Boozt
5c90e84197afa10eb4ea146e,I really enjoy shopping on Zalando…,I really enjoy shopping on Zalando website. If people complain about delivery this is down to Hermes and they are rubbish.,Britain (UK),Zalando
5df0e981c84545096040a594,Zalando returns system failures,"Zalando is usually pretty efficient, but their current returns system is completely broken. They have admitted their returns system in the warehouse is overloaded. Two of my parcels have gone missing, and you have to wait 2 weeks after you have returned your parcel before they will even investigate your lost return. You then have to complete a form to get a refund.This is just not acceptable when compared to other online retailers and I will really think hard before ordering from them again.",Britain (UK),Zalando
578ff3dc0000ff000972b1f3,Waiting and waiting!! Fed up!!,Placed my first order on the 5th of July.it is now the 20th and I have not received my items!! Yes they were affordable but if I have to wait this long I will not be buying from them again .,Britain (UK),Sheinside
59f321f331302a0ef48fe094,Easy to buy from and great …,Easy to buy from and great communication i will buy from here again,Britain (UK),Zalando
60762698f85d7508705ae764,Good stuff,Good stuff...I will continue  to shop wish,United States,Wish
60b68168f9f4870a94b3345e,Do not buy anything from Wish,Do not buy anything from Wish. They say you can cancel your order. That is BS. Their customer service is poor. You cannot talk to an agent. They also make it very difficult to change your email and phone # in your settings.,Canada,Wish
5f854664798e6f07705c7595,Yes!!!,Delivery was perfect. The fit of the dress was amazing. I am definately shopping on Boozt again.,Belgium,Boozt
59c4d64731302a03bc8bfd66,Everything about the site was really …,Everything about the site was really great. Ordering  delivery etc all brilliant. I had to return the item but that was down to my size and shape. No fault of the site. Would order again.,Britain (UK),Zalando
605fb13af85d750870393ee7,Wish,"I like using Wish, while it does take a long time to get your order China to Canada it is not anything unexpected. For the most part the products are good for the price but you do get the odd dud but wish is quick to rectify the problem.",Canada,Wish
60ae64fff9f4870a94adc44e,"FRAUDULENT ACTIVITIES, COUNTERFEIT ITEMS, NO CUSTOMER SERVICE","I placed a few orders on the same day and chose to have them shipped to a business in the city where I live to save shipping fees  The website stated that I would be notified once they arrived.  I expected that the business would call to let me know that my order was there.  According to their website, on April 14th my order was in transit  On April 28th I got a message from WISH that stated on April 24th my order was shipped back to them because I missed the 14 days to pick it up.  Explain how my order was in transit and then 10 days later returned to them. How did I miss the 14 days? This is a scam!  They do not return all your money because they claim there is a restocking fee.  If my order had truly arrived at the store then the order tracking on the WISH website should have been updated to say it arrived!  If it did arrive, then why was I not called to say that my order was ready to be picked up? Of course there is no customer service, it is just an automated system.  The website states that if you have additional problems to contact your credit card company!  Last year I ordered some Bose headphones, it was obvious when they arrived that they were counterfeit.  I gave them another chance, which was my mistake.  Getting counterfeit products should have told me what their business practices were.  WISH is basically stealing money from customers in many ways!  My advise is to STAY AWAY FROM THIS COMPANY!",Canada,Wish
5ffc5deb755dc1032c1275a9,As I have already said,"As I have already said, a very reliable site with a lot of nice things to buy! Always up to date!",Greece,Boozt
5ff09b74755dc107e0d52e84,shein is a good website,"shein is a good website. I see people complaining orders are not coming PAY SHIPPING GUARANTEE! I have not payed shipping guarantee once, I did get the order it just took forever(about a month/month and a half) the shoes, clothes and everything has been great i love it!",Britain (UK),Sheinside
5bab66828c83fd06e0c4a652,I had a question and I wrote to their…,"I had a question and I wrote to their costumer services. They answered me very quickly and helped me. Nelly made everything very easy for me, and I will definitely shop there again.  Ellen at their costumer service was very serviceminded.",Sweden,Nelly
60c5ca4df9f4870bbc53d7a1,DO NOT BUY FROM THIS COMPANY THEY ARE A…,DO NOT BUY FROM THIS COMPANY THEY ARE A SCAM THAT ADVERTISES PRODUCTS BUT SEND. HEAP CRAP,Britain (UK),Wish
